{
  "body_path": "memory/decisions/schema-backed-agent-memory-discipline.md",
  "content_hash": "sha256:ef9fdb98fb9dd8da331b6cb532916aac8d2e771e6db161e5e2ea885b7973bbbf",
  "created_at": "2026-05-02T16:13:27+02:00",
  "evidence": [],
  "facets": {
    "category": "decision-rationale"
  },
  "id": "decision.schema-backed-agent-memory-discipline",
  "scope": {
    "branch": null,
    "kind": "project",
    "project": "project.aictx",
    "task": null
  },
  "source": {
    "kind": "agent",
    "task": "Implement schema-backed agent memory discipline"
  },
  "status": "active",
  "tags": [
    "schema",
    "facets",
    "evidence",
    "agent-guidance",
    "suggest"
  ],
  "title": "Schema-backed agent memory discipline",
  "type": "decision",
  "updated_at": "2026-05-02T16:14:28+02:00"
}
