{
  "body_path": "memory/workflows/post-task-verification.md",
  "content_hash": "sha256:302e2db8efc5739f36524bfd3387cd3ef102f835673a09b23e774d4ce19f5673",
  "created_at": "2026-05-12T17:53:06+02:00",
  "evidence": [
    {
      "id": "package.json",
      "kind": "file"
    }
  ],
  "facets": {
    "applies_to": [
      "package.json"
    ],
    "category": "testing",
    "load_modes": [
      "coding",
      "debugging",
      "review"
    ]
  },
  "id": "workflow.post-task-verification",
  "scope": {
    "branch": null,
    "kind": "project",
    "project": "project.aictx",
    "task": null
  },
  "source": {
    "kind": "cli",
    "task": "Proposed bootstrap memory patch from deterministic repository analysis"
  },
  "status": "active",
  "tags": [
    "verification",
    "testing",
    "workflow"
  ],
  "title": "Post-task verification",
  "type": "workflow",
  "updated_at": "2026-05-12T17:53:06+02:00"
}
