{
  "body_path": "memory/workflows/package-scripts.md",
  "content_hash": "sha256:5056ecf02ff11e34ca21fc623aa4cc680a11333d9b49c4edaec5d2c65fa0367f",
  "created_at": "2026-05-16T18:52:44+02:00",
  "evidence": [],
  "id": "workflow.package-scripts",
  "scope": {
    "branch": null,
    "kind": "project",
    "project": "project.memory",
    "task": null
  },
  "source": {
    "kind": "cli",
    "task": "Proposed bootstrap memory patch from deterministic repository analysis"
  },
  "status": "active",
  "tags": [
    "package",
    "workflow"
  ],
  "title": "Package scripts",
  "type": "workflow",
  "updated_at": "2026-05-16T18:52:44+02:00"
}
