{
  "body_path": "memory/constraints/node-engine.md",
  "content_hash": "sha256:dfd3d04d6b800089243098135e1194694db05e040c4edeb23bc8c162a5fe34f7",
  "created_at": "2026-05-04T20:21:52+02:00",
  "evidence": [],
  "facets": {
    "category": "stack"
  },
  "id": "constraint.node-engine",
  "scope": {
    "branch": null,
    "kind": "project",
    "project": "project.aictx",
    "task": null
  },
  "source": {
    "kind": "cli",
    "task": "Proposed bootstrap memory patch from deterministic repository analysis"
  },
  "status": "active",
  "tags": [
    "node",
    "runtime"
  ],
  "title": "Node engine requirement",
  "type": "constraint",
  "updated_at": "2026-05-04T20:21:52+02:00"
}
