{
  "body_path": "memory/gotchas/pnpm-exec-aictx-old-reader.md",
  "content_hash": "sha256:afb3488e1fb922e1ae8ee4278763d7094575b0c8fb336d8b59ce06bb69f2ba8c",
  "created_at": "2026-05-04T16:24:33+02:00",
  "evidence": [
    {
      "id": "package.json",
      "kind": "file"
    },
    {
      "id": "pnpm-lock.yaml",
      "kind": "file"
    },
    {
      "id": ".aictx/config.json",
      "kind": "file"
    }
  ],
  "facets": {
    "applies_to": [
      "package.json",
      "pnpm-lock.yaml",
      ".aictx/config.json",
      "src/cli/main.ts",
      "src/mcp/server.ts"
    ],
    "category": "gotcha",
    "load_modes": [
      "debugging",
      "coding",
      "onboarding"
    ]
  },
  "id": "gotcha.pnpm-exec-aictx-old-reader",
  "scope": {
    "branch": null,
    "kind": "project",
    "project": "project.aictx",
    "task": null
  },
  "source": {
    "kind": "agent",
    "task": "Investigated Aictx schema validation failures caused by old local CLI/MCP readers"
  },
  "status": "active",
  "tags": [
    "cli",
    "schema",
    "dev-dependency",
    "mcp"
  ],
  "title": "pnpm exec aictx can use the old dev dependency",
  "type": "gotcha",
  "updated_at": "2026-05-04T16:24:33+02:00"
}
