{
  "body_path": "memory/decisions/product-command-surface-is-memory.md",
  "content_hash": "sha256:e36d924639b9206451e2be20926ba4fcb74840fd6935e56b24e11c55167907a1",
  "created_at": "2026-05-17T00:17:58+02:00",
  "evidence": [
    {
      "id": "package.json",
      "kind": "file"
    },
    {
      "id": "src/core/paths.ts",
      "kind": "file"
    },
    {
      "id": "README.md",
      "kind": "file"
    }
  ],
  "facets": {
    "applies_to": [
      "package.json",
      "src/cli/main.ts",
      "src/core/paths.ts",
      "src/registry/projects.ts",
      "README.md",
      "docs/src/content/docs/cli.md"
    ],
    "category": "decision-rationale"
  },
  "id": "decision.product-command-surface-is-memory",
  "scope": {
    "branch": null,
    "kind": "project",
    "project": "project.memory",
    "task": null
  },
  "source": {
    "kind": "agent",
    "task": "rename product and command surface from aictx to memory"
  },
  "status": "active",
  "tags": [
    "rename",
    "cli",
    "storage",
    "branding"
  ],
  "title": "Product command surface is memory",
  "type": "decision",
  "updated_at": "2026-05-17T00:17:58+02:00"
}
