{
  "body_path": "memory/decisions/deterministic-smart-retrieval.md",
  "content_hash": "sha256:b26519da84e72bff8be8061719cf2d1a40904b1c1f072ff5436e5660e5b89561",
  "created_at": "2026-05-02T21:19:57+02:00",
  "evidence": [
    {
      "id": "src/retrieval/hints.ts",
      "kind": "file"
    },
    {
      "id": "src/index/search.ts",
      "kind": "file"
    },
    {
      "id": "src/context/compile.ts",
      "kind": "file"
    },
    {
      "id": "src/context/render.ts",
      "kind": "file"
    },
    {
      "id": "src/index/rebuild.ts",
      "kind": "file"
    },
    {
      "id": "src/core/git.ts",
      "kind": "file"
    },
    {
      "id": "docs/indexing-and-context-compiler-spec.md",
      "kind": "file"
    }
  ],
  "facets": {
    "applies_to": [
      "src/retrieval/hints.ts",
      "src/index/search.ts",
      "src/context/compile.ts",
      "src/context/render.ts",
      "src/index/rebuild.ts",
      "src/discipline/audit.ts"
    ],
    "category": "decision-rationale",
    "load_modes": [
      "coding",
      "review",
      "architecture"
    ]
  },
  "id": "decision.deterministic-smart-retrieval",
  "scope": {
    "branch": null,
    "kind": "project",
    "project": "project.aictx",
    "task": null
  },
  "source": {
    "kind": "agent",
    "task": "Implemented deterministic smart retrieval for Aictx"
  },
  "status": "active",
  "tags": [
    "retrieval",
    "index",
    "hints",
    "architecture",
    "audit"
  ],
  "title": "Deterministic smart retrieval",
  "type": "decision",
  "updated_at": "2026-05-02T21:19:57+02:00"
}
