{
  "body_path": "memory/gotchas/upgrade-must-repair-partial-v2-schema-state.md",
  "content_hash": "sha256:5a83766347a5d204fb41e5605e918d74c051f851978eca97526ca3fd93c28835",
  "created_at": "2026-05-02T16:55:52+02:00",
  "evidence": [
    {
      "id": "src/storage/upgrade.ts",
      "kind": "file"
    },
    {
      "id": "test/unit/storage/upgrade.test.ts",
      "kind": "file"
    }
  ],
  "facets": {
    "applies_to": [
      "src/storage/upgrade.ts",
      "test/unit/storage/upgrade.test.ts"
    ],
    "category": "gotcha",
    "load_modes": [
      "coding",
      "review",
      "debugging"
    ]
  },
  "id": "gotcha.upgrade-must-repair-partial-v2-schema-state",
  "scope": {
    "branch": null,
    "kind": "project",
    "project": "project.aictx",
    "task": null
  },
  "source": {
    "kind": "agent",
    "task": "Double-check schema-backed memory changes"
  },
  "status": "active",
  "tags": [
    "upgrade",
    "schema",
    "migration"
  ],
  "title": "Upgrade must repair partial v2 schema state",
  "type": "gotcha",
  "updated_at": "2026-05-02T16:55:52+02:00"
}
