{
  "body_path": "memory/architecture.md",
  "content_hash": "sha256:9b75462d8cdcd8512eafe98cdead997c66031c993a05ac0fc5b493d70f3c3fca",
  "created_at": "2026-05-16T18:52:43+02:00",
  "evidence": [],
  "facets": {
    "category": "architecture"
  },
  "id": "architecture.current",
  "scope": {
    "branch": null,
    "kind": "project",
    "project": "project.memory",
    "task": null
  },
  "source": {
    "kind": "cli",
    "task": "Proposed bootstrap memory patch from deterministic repository analysis"
  },
  "status": "active",
  "tags": [
    "architecture"
  ],
  "title": "Current Architecture",
  "type": "architecture",
  "updated_at": "2026-05-16T18:52:44+02:00"
}
