{
  "body_path": "memory/gotchas/homebrew-formula-output-must-avoid-pnpm-banners.md",
  "content_hash": "sha256:b3ef8fad9d9f8c8979ac1892372595e2a492b77f21e12d71ad3c302139a32e92",
  "created_at": "2026-05-17T10:22:44+02:00",
  "evidence": [
    {
      "id": ".github/workflows/release.yml",
      "kind": "file"
    },
    {
      "id": "scripts/render-homebrew-formula.mjs",
      "kind": "file"
    }
  ],
  "facets": {
    "applies_to": [
      ".github/workflows/release.yml",
      "scripts/render-homebrew-formula.mjs"
    ],
    "category": "gotcha"
  },
  "id": "gotcha.homebrew-formula-output-must-avoid-pnpm-banners",
  "scope": {
    "branch": null,
    "kind": "project",
    "project": "project.memory",
    "task": null
  },
  "source": {
    "kind": "agent",
    "task": "add Homebrew publishing support"
  },
  "status": "active",
  "tags": [
    "release",
    "homebrew",
    "pnpm"
  ],
  "title": "Homebrew formula output must avoid pnpm banners",
  "type": "gotcha",
  "updated_at": "2026-05-17T10:22:44+02:00"
}
