{
  "body_path": "memory/constraints/package-manager.md",
  "content_hash": "sha256:708b8939421a4c025c3453536b3fb254b14ed50523336c27efa8305f9d26935f",
  "created_at": "2026-05-07T18:30:51+02:00",
  "evidence": [],
  "id": "constraint.package-manager",
  "scope": {
    "branch": null,
    "kind": "project",
    "project": "project.aictx",
    "task": null
  },
  "source": {
    "kind": "cli",
    "task": "Proposed bootstrap memory patch from deterministic repository analysis"
  },
  "status": "active",
  "tags": [
    "pnpm",
    "dependencies"
  ],
  "title": "Package manager",
  "type": "constraint",
  "updated_at": "2026-05-07T18:30:51+02:00"
}
