{
  "body_path": "memory/facts/aictx-ships-generated-skill-and-plugin-distribution-artifacts.md",
  "content_hash": "sha256:f3d01db599e26aba69b317a3ed3284fd4fdb6e1cedb12d180223dadb3f78de91",
  "created_at": "2026-05-15T15:24:09+02:00",
  "evidence": [
    {
      "id": ".agents/plugins/marketplace.json",
      "kind": "file"
    },
    {
      "id": ".claude-plugin/marketplace.json",
      "kind": "file"
    },
    {
      "id": "README.md",
      "kind": "file"
    },
    {
      "id": "docs/src/content/docs/plugin-publishing.md",
      "kind": "file"
    },
    {
      "id": "scripts/generate-agent-guidance.mjs",
      "kind": "file"
    }
  ],
  "facets": {
    "applies_to": [
      "integrations/templates/agent-guidance.md",
      "scripts/generate-agent-guidance.mjs",
      ".agents/plugins/marketplace.json",
      ".claude-plugin/marketplace.json",
      "integrations/codex/skills/aictx-memory/SKILL.md",
      "integrations/codex/plugins/aictx-memory/.codex-plugin/plugin.json",
      "integrations/codex/plugins/aictx-memory/README.md",
      "integrations/claude/plugins/aictx-memory/.claude-plugin/plugin.json",
      "integrations/claude/plugins/aictx-memory/README.md",
      "docs/src/content/docs/plugin-publishing.md",
      "docs/src/content/docs/agent-recipes.md",
      "docs/src/content/docs/specializing-aictx.md",
      "README.md"
    ],
    "category": "debugging-fact"
  },
  "id": "fact.aictx-ships-generated-skill-and-plugin-distribution-artifacts",
  "scope": {
    "branch": null,
    "kind": "project",
    "project": "project.aictx",
    "task": null
  },
  "source": {
    "kind": "agent",
    "task": "implement generated Codex and Claude skill plugin distribution artifacts"
  },
  "status": "active",
  "tags": [
    "agent-guidance",
    "integrations",
    "distribution",
    "codex",
    "claude"
  ],
  "title": "Aictx ships generated skill and plugin distribution artifacts",
  "type": "fact",
  "updated_at": "2026-05-16T10:15:07+02:00"
}
