{
  "body_path": "memory/facts/open-source-readiness-foundation-is-configured.md",
  "content_hash": "sha256:b04f07065912ecc9ea334f6c8055b04dc1c7d4f5647fddfa266b99c506d0ebc4",
  "created_at": "2026-05-07T18:07:45+02:00",
  "evidence": [
    {
      "id": ".github/workflows/ci.yml",
      "kind": "file"
    },
    {
      "id": ".github/workflows/release.yml",
      "kind": "file"
    },
    {
      "id": "CONTRIBUTING.md",
      "kind": "file"
    },
    {
      "id": "SECURITY.md",
      "kind": "file"
    },
    {
      "id": "RELEASE.md",
      "kind": "file"
    },
    {
      "id": "ROADMAP.md",
      "kind": "file"
    }
  ],
  "facets": {
    "applies_to": [
      ".github/workflows/ci.yml",
      ".github/workflows/release.yml",
      "CONTRIBUTING.md",
      "SECURITY.md",
      "RELEASE.md",
      "ROADMAP.md"
    ],
    "category": "debugging-fact"
  },
  "id": "fact.open-source-readiness-foundation-is-configured",
  "scope": {
    "branch": null,
    "kind": "project",
    "project": "project.aictx",
    "task": null
  },
  "source": {
    "kind": "agent",
    "task": "Open source readiness implementation"
  },
  "status": "active",
  "tags": [
    "open-source",
    "ci",
    "release",
    "security"
  ],
  "title": "Open source readiness foundation is configured",
  "type": "fact",
  "updated_at": "2026-05-07T18:07:45+02:00"
}
