{
  "body_path": "memory/workflows/vercel-public-site-deployment.md",
  "content_hash": "sha256:1a15983a4a75c7c4c927241989fe014db21fa7d3112f2be5ba4728aa7ab1389b",
  "created_at": "2026-05-05T22:19:29+02:00",
  "evidence": [
    {
      "id": "vercel.json",
      "kind": "file"
    },
    {
      "id": "package.json",
      "kind": "file"
    },
    {
      "id": "pnpm-lock.yaml",
      "kind": "file"
    },
    {
      "id": "Vercel production deployment dpl_8qz4eAMhf2oB5C8nPc6fWY6fyA5E verified on 2026-05-05",
      "kind": "task"
    },
    {
      "id": "Vercel domains inspect aictx.dev and www.aictx.dev on 2026-05-05",
      "kind": "task"
    },
    {
      "id": "b442514",
      "kind": "commit"
    }
  ],
  "facets": {
    "applies_to": [
      "site",
      "site/dist",
      "site/src/content/blog",
      "package.json",
      "pnpm-lock.yaml",
      "vercel.json"
    ],
    "category": "workflow",
    "load_modes": [
      "coding",
      "debugging",
      "onboarding"
    ]
  },
  "id": "workflow.vercel-public-site-deployment",
  "scope": {
    "branch": null,
    "kind": "project",
    "project": "project.aictx",
    "task": null
  },
  "source": {
    "kind": "agent",
    "task": "Record Vercel custom domain DNS records"
  },
  "status": "superseded",
  "superseded_by": "workflow.cloudflare-public-site-deployment",
  "tags": [
    "site",
    "vercel",
    "astro",
    "deployment",
    "blog"
  ],
  "title": "Vercel public site deployment",
  "type": "workflow",
  "updated_at": "2026-05-05T22:56:56+02:00"
}
