{
  "body_path": "memory/decisions/public-docs-centralize-exact-contracts.md",
  "content_hash": "sha256:231cbc15d8a243a480c8c2c6e51c4558caa757fc611cb0edc7e8f01ff26ee224",
  "created_at": "2026-05-16T14:47:14+02:00",
  "evidence": [
    {
      "id": "docs/src/content/docs/mcp.md",
      "kind": "file"
    },
    {
      "id": "docs/src/content/docs/reference.md",
      "kind": "file"
    },
    {
      "id": "test/unit/agent-guidance/content.test.ts",
      "kind": "file"
    },
    {
      "id": "test/integration/release/packaging.test.ts",
      "kind": "file"
    }
  ],
  "facets": {
    "applies_to": [
      "docs/src/content/docs/",
      "test/unit/agent-guidance/content.test.ts",
      "test/integration/release/packaging.test.ts"
    ],
    "category": "decision-rationale"
  },
  "id": "decision.public-docs-centralize-exact-contracts",
  "scope": {
    "branch": null,
    "kind": "project",
    "project": "project.aictx",
    "task": null
  },
  "source": {
    "kind": "agent",
    "task": "refresh public docs copy and remove brittle docs copy-lock tests"
  },
  "status": "active",
  "tags": [
    "docs",
    "copy",
    "testing"
  ],
  "title": "Public docs centralize exact contracts",
  "type": "decision",
  "updated_at": "2026-05-16T14:47:14+02:00"
}
