{
  "body_path": "memory/workflows/demo-viewer-deployment.md",
  "content_hash": "sha256:44589f5caf867207579d065186c286e0c14901c58c1b9a073cec8a217df141b4",
  "created_at": "2026-05-13T18:23:33+02:00",
  "evidence": [
    {
      "id": "scripts/build-viewer-demo-data.mjs",
      "kind": "file"
    },
    {
      "id": "src/viewer/demo-worker.ts",
      "kind": "file"
    },
    {
      "id": "wrangler.demo.jsonc",
      "kind": "file"
    },
    {
      "id": "package.json",
      "kind": "file"
    }
  ],
  "facets": {
    "applies_to": [
      "scripts/build-viewer-demo-data.mjs",
      "src/viewer/demo-data.generated.json",
      "src/viewer/demo-worker.ts",
      "viewer/src/App.svelte",
      "site/src/pages/index.astro",
      "site/public/assets/viewer-demo.png",
      "wrangler.demo.jsonc",
      "package.json"
    ],
    "category": "workflow"
  },
  "id": "workflow.demo-viewer-deployment",
  "scope": {
    "branch": null,
    "kind": "project",
    "project": "project.aictx",
    "task": null
  },
  "source": {
    "kind": "agent",
    "task": "implemented Cloudflare Worker read-only seeded viewer demo for demo.aictx.dev"
  },
  "status": "active",
  "tags": [
    "viewer",
    "demo",
    "cloudflare",
    "deployment"
  ],
  "title": "Demo viewer deployment",
  "type": "workflow",
  "updated_at": "2026-05-14T16:04:32+02:00"
}
