{
  "body_path": "memory/decisions/setup-prompt-installs-stay-unpinned.md",
  "content_hash": "sha256:ba84f5de858de602ac42fec0cc8beec7cbe08c522f4f9494e3e69d8495ec5608",
  "created_at": "2026-05-16T10:30:23+02:00",
  "evidence": [
    {
      "id": "README.md",
      "kind": "file"
    },
    {
      "id": "docs/src/content/docs/index.md",
      "kind": "file"
    },
    {
      "id": "package.json",
      "kind": "file"
    },
    {
      "id": "test/unit/scripts/repo-scripts.test.ts",
      "kind": "file"
    },
    {
      "id": "test/integration/release/packaging.test.ts",
      "kind": "file"
    }
  ],
  "facets": {
    "applies_to": [
      "README.md",
      "docs/src/content/docs/index.md",
      "package.json",
      "test/unit/scripts/repo-scripts.test.ts",
      "test/integration/release/packaging.test.ts"
    ],
    "category": "decision-rationale"
  },
  "id": "decision.setup-prompt-installs-stay-unpinned",
  "scope": {
    "branch": null,
    "kind": "project",
    "project": "project.aictx",
    "task": null
  },
  "source": {
    "kind": "agent",
    "task": "Remove setup prompt package-version pinning from docs and version patch release command"
  },
  "status": "active",
  "tags": [],
  "title": "Setup prompt installs stay unpinned",
  "type": "decision",
  "updated_at": "2026-05-16T10:30:23+02:00"
}
