{
  "body_path": "memory/workflows/ci-test-prerequisites.md",
  "content_hash": "sha256:28d285aa10363b5d0ce518958f86e5eb6f1493253edfa30c56fcd5e64207196a",
  "created_at": "2026-05-08T00:13:13+02:00",
  "evidence": [
    {
      "id": ".github/workflows/ci.yml",
      "kind": "file"
    }
  ],
  "facets": {
    "applies_to": [
      ".github/workflows/ci.yml",
      "test/integration/viewer/shell.test.ts",
      "test/integration/viewer/export-obsidian.test.ts",
      "test/integration/release/packaging.test.ts"
    ],
    "category": "testing"
  },
  "id": "workflow.ci-test-prerequisites",
  "scope": {
    "branch": null,
    "kind": "project",
    "project": "project.aictx",
    "task": null
  },
  "source": {
    "kind": "agent",
    "task": "fixed CI test failures for release packaging and viewer Playwright tests"
  },
  "status": "active",
  "tags": [],
  "title": "CI test prerequisites",
  "type": "workflow",
  "updated_at": "2026-05-08T00:13:13+02:00"
}
