{
  "body_path": "memory/constraints/pull-request-descriptions-are-coding-agent-prompts.md",
  "content_hash": "sha256:f81760d4fefe9c8239f6cb9f0f762d17fa73ffb05792c6a7204f3338c764d4ea",
  "created_at": "2026-05-07T18:26:40+02:00",
  "evidence": [
    {
      "id": ".github/pull_request_template.md",
      "kind": "file"
    },
    {
      "id": "CONTRIBUTING.md",
      "kind": "file"
    }
  ],
  "facets": {
    "applies_to": [
      ".github/pull_request_template.md",
      "CONTRIBUTING.md"
    ],
    "category": "concept"
  },
  "id": "constraint.pull-request-descriptions-are-coding-agent-prompts",
  "scope": {
    "branch": null,
    "kind": "project",
    "project": "project.aictx",
    "task": null
  },
  "source": {
    "kind": "agent",
    "task": "Make PR descriptions prompt-first"
  },
  "status": "active",
  "tags": [
    "contributing",
    "pull-requests",
    "agent-guidance"
  ],
  "title": "Pull request descriptions are coding-agent prompts",
  "type": "constraint",
  "updated_at": "2026-05-07T18:26:40+02:00"
}
