{
  "body_path": "memory/gotchas/connected-mcp-can-be-stale.md",
  "content_hash": "sha256:25908e865e9465058af0feb00592f038de874fea2b15f32c3ab3682d8ee7dfab",
  "created_at": "2026-05-02T17:23:32+02:00",
  "evidence": [
    {
      "id": "src/mcp/tools/load-memory.ts",
      "kind": "file"
    },
    {
      "id": "test/integration/mcp/read-tools.test.ts",
      "kind": "file"
    },
    {
      "id": "Connected mcp__aictx__load_memory returned AICtxSchemaValidationFailed while project-local MCP tests passed",
      "kind": "task"
    }
  ],
  "facets": {
    "applies_to": [
      "src/mcp/tools/load-memory.ts",
      "src/mcp/server.ts",
      "test/integration/mcp/read-tools.test.ts"
    ],
    "category": "gotcha",
    "load_modes": [
      "debugging",
      "review"
    ]
  },
  "id": "gotcha.connected-mcp-can-be-stale",
  "scope": {
    "branch": null,
    "kind": "project",
    "project": "project.aictx",
    "task": null
  },
  "source": {
    "kind": "agent",
    "task": "Fix MCP save_memory_patch and audit MCP load_memory"
  },
  "status": "active",
  "tags": [
    "mcp",
    "load-memory",
    "stale-server"
  ],
  "title": "Connected MCP can be stale",
  "type": "gotcha",
  "updated_at": "2026-05-02T17:23:32+02:00"
}
