{
  "body_path": "memory/gotchas/init-viewer-placeholders.md",
  "content_hash": "sha256:9182195792babcbb33a2b5db6c8b19a1d8673671a2755e3d385d4960838c7678",
  "created_at": "2026-05-01T16:33:34+02:00",
  "id": "gotcha.init-viewer-placeholders",
  "scope": {
    "branch": null,
    "kind": "project",
    "project": "project.aictx",
    "task": null
  },
  "source": {
    "kind": "agent",
    "task": "Debug why Aictx viewer shows little or no data after init"
  },
  "status": "active",
  "tags": [
    "init",
    "viewer",
    "onboarding"
  ],
  "title": "Init viewer only shows placeholder memory",
  "type": "gotcha",
  "updated_at": "2026-05-01T17:33:27+02:00"
}
