{
  "body_path": "memory/decisions/non-blocking-dirty-memory-saves.md",
  "content_hash": "sha256:9a3ad3cd21e26048b1eb30dd250e984539f34c6a2507bc034af9d38f3c575ca4",
  "created_at": "2026-05-02T10:37:12+02:00",
  "evidence": [],
  "facets": {
    "category": "decision-rationale"
  },
  "id": "decision.non-blocking-dirty-memory-saves",
  "scope": {
    "branch": null,
    "kind": "project",
    "project": "project.aictx",
    "task": null
  },
  "source": {
    "kind": "agent",
    "task": "Implement onboarding and save reliability improvements"
  },
  "status": "active",
  "tags": [
    "save",
    "recovery",
    "dirty-memory",
    "storage"
  ],
  "title": "Dirty memory saves recover and continue",
  "type": "decision",
  "updated_at": "2026-05-02T10:37:12+02:00"
}
