{
  "body_path": "memory/decisions/cli-first-mcp-compatible-guidance.md",
  "content_hash": "sha256:3f4b51b63a93d1b51f2ac4a2fd6428f9a7fceba3f5a881e21b65f25f4958a9a7",
  "created_at": "2026-05-04T16:46:38+02:00",
  "evidence": [
    {
      "id": "integrations/templates/agent-guidance.md",
      "kind": "file"
    },
    {
      "id": "src/storage/init.ts",
      "kind": "file"
    },
    {
      "id": "docs/agent-integration.md",
      "kind": "file"
    },
    {
      "id": "docs/mcp-and-cli-api-spec.md",
      "kind": "file"
    },
    {
      "id": "README.md",
      "kind": "file"
    }
  ],
  "facets": {
    "applies_to": [
      "integrations/templates/agent-guidance.md",
      "src/storage/init.ts",
      "docs/agent-integration.md",
      "docs/mcp-and-cli-api-spec.md",
      "README.md"
    ],
    "category": "decision-rationale",
    "load_modes": [
      "coding",
      "onboarding",
      "review"
    ]
  },
  "id": "decision.cli-first-mcp-compatible-guidance",
  "scope": {
    "branch": null,
    "kind": "project",
    "project": "project.aictx",
    "task": null
  },
  "source": {
    "kind": "agent",
    "task": "Implemented CLI-first Aictx guidance update while preserving MCP tools"
  },
  "status": "active",
  "tags": [
    "guidance",
    "cli",
    "mcp",
    "agents"
  ],
  "title": "Agent guidance is CLI-first and MCP-compatible",
  "type": "decision",
  "updated_at": "2026-05-04T16:46:38+02:00"
}
