{
  "body_path": "memory/workflows/cloudflare-public-site-deployment.md",
  "content_hash": "sha256:6598d99117fe1a8a090077f856c8993c5a3bb9801a3a93dc02cff0bfd0eefc44",
  "created_at": "2026-05-05T22:56:56+02:00",
  "evidence": [
    {
      "id": "wrangler.jsonc",
      "kind": "file"
    },
    {
      "id": "dig +trace showed aictx.dev delegated to Cloudflare but authoritative A/AAAA for apex was empty on 2026-05-05",
      "kind": "task"
    },
    {
      "id": "forced-edge curl returned 200 for https://aictx.dev/ but 530 for https://aictx.dev/blog/ on 2026-05-05",
      "kind": "task"
    }
  ],
  "facets": {
    "applies_to": [
      "site",
      "site/dist",
      "site/src/content/blog",
      "site/src/pages/404.astro",
      "package.json",
      "pnpm-lock.yaml",
      "wrangler.jsonc",
      ".node-version"
    ],
    "category": "workflow",
    "load_modes": [
      "coding",
      "debugging",
      "onboarding"
    ]
  },
  "id": "workflow.cloudflare-public-site-deployment",
  "scope": {
    "branch": null,
    "kind": "project",
    "project": "project.aictx",
    "task": null
  },
  "source": {
    "kind": "agent",
    "task": "Record Cloudflare custom domain routing gotcha"
  },
  "status": "active",
  "tags": [
    "site",
    "cloudflare",
    "workers",
    "astro",
    "deployment",
    "blog",
    "wrangler"
  ],
  "title": "Cloudflare public site deployment",
  "type": "workflow",
  "updated_at": "2026-05-05T23:20:04+02:00"
}
